id,title,text,created_at,score,num_comments,url,cleaned_text,sentiment,textblob_score,vader_score,sentiment_category
1hbtgf9,"Spying on Student Devices, Schools Aim to Intercept Self-Harm Before It Happens
New technology alerts schools when students type words related to suicide.",,2024-12-11 13:28:38,0,14,https://www.nytimes.com/2024/12/09/health/suicide-monitoring-software-schools.html,,"{'textblob_score': 0.0, 'vader_score': 0.0, 'sentiment_category': 'Neutral'}",0.0,0.0,Neutral
1hbrirm,YouTube can now automatically dub your videos,,2024-12-11 11:35:31,0,7,https://www.androidauthority.com/youtube-auto-dubbing-3507623/,,"{'textblob_score': 0.0, 'vader_score': 0.0, 'sentiment_category': 'Neutral'}",0.0,0.0,Neutral
1hbo9nk,JR East to launch scan-free ticket gates for app users within 10 yrs,,2024-12-11 07:30:18,0,3,https://english.kyodonews.net/news/2024/12/d5af6e3d14f1-jr-east-to-launch-scan-free-ticket-gates-for-app-users-within-10-yrs.html,,"{'textblob_score': 0.0, 'vader_score': 0.0, 'sentiment_category': 'Neutral'}",0.0,0.0,Neutral
1halasl,Google unveils ‘mindboggling’ quantum computing chip,,2024-12-09 21:43:49,156,90,https://www.theguardian.com/technology/2024/dec/09/google-unveils-mindboggling-quantum-computing-chip,,"{'textblob_score': 0.0, 'vader_score': 0.0, 'sentiment_category': 'Neutral'}",0.0,0.0,Neutral
1hb2722,Researchers design new shape-changing device for visually impaired,,2024-12-10 13:51:29,8,0,https://interestingengineering.com/innovation/shape-shifting-tech-aids-navigation,,"{'textblob_score': 0.0, 'vader_score': 0.0, 'sentiment_category': 'Neutral'}",0.0,0.0,Neutral
1hb71aa,Surrey announces world's first AI model for near-instant image creation on consumer-grade hardware,,2024-12-10 17:25:49,4,7,https://www.surrey.ac.uk/news/surrey-announces-worlds-first-ai-model-near-instant-image-creation-consumer-grade-hardware,,"{'textblob_score': 0.0, 'vader_score': 0.0, 'sentiment_category': 'Neutral'}",0.0,0.0,Neutral
1hbw8eu,LinkedIn wants to have its TikTok era,,2024-12-11 15:39:19,0,27,https://www.businessinsider.com/linkedin-expanding-video-feed-how-creators-grow-audience-tiktok-2024-12,,"{'textblob_score': 0.0, 'vader_score': 0.0, 'sentiment_category': 'Neutral'}",0.0,0.0,Neutral
1h9uyjx,How one of the world’s richest men is avoiding $8 billion in taxes — Nvidia CEO Jensen Huang has ‘done a magnificent job’ using tax strategies ubiquitous among the ultrawealthy,,2024-12-08 22:42:10,10951,470,https://www.nytimes.com/2024/12/05/business/nvidia-jensen-huang-estate-taxes.html,,"{'textblob_score': 0.0, 'vader_score': 0.0, 'sentiment_category': 'Neutral'}",0.0,0.0,Neutral
1hazlsa,"SAP says GenAI will help solve legacy migration skills shortage - As 2027 support deadline looms, German vendor puts faith in on-trend tech to help SIs do more with less",,2024-12-10 11:22:27,10,1,https://www.theregister.com/2024/12/10/sap_says_genai_will_help/,,"{'textblob_score': 0.0, 'vader_score': 0.0, 'sentiment_category': 'Neutral'}",0.0,0.0,Neutral
1ha99x5,"We can't make this stuff up: tech companies Palantir and Anduril form fellowship for AI adventures - Meanwhile, Sauron secures funding. Really.",,2024-12-09 13:05:16,591,40,https://www.theregister.com/2024/12/09/palantir_anduril_alliance/,,"{'textblob_score': 0.0, 'vader_score': 0.0, 'sentiment_category': 'Neutral'}",0.0,0.0,Neutral
1hakre2,"New KOSA, Same As Old KOSA, But Now With Elon’s Ignorant Endorsement",,2024-12-09 21:21:03,124,6,https://www.techdirt.com/2024/12/09/new-kosa-same-as-old-kosa-but-now-with-elons-ignorant-endorsement/#comment-4207737,,"{'textblob_score': 0.0, 'vader_score': 0.0, 'sentiment_category': 'Neutral'}",0.0,0.0,Neutral
1habocn,NATO plans to deploy sea drones to monitor and protect undersea cables — Admiral expects drone fleet patrols to begin from June 2025 ,,2024-12-09 15:03:00,384,27,https://www.tomshardware.com/networking/nato-plans-to-deploy-sea-drones-to-monitor-and-protect-undersea-cables-admiral-expects-drone-fleet-patrols-to-begin-from-june-2025,,"{'textblob_score': 0.0, 'vader_score': 0.0, 'sentiment_category': 'Neutral'}",0.0,0.0,Neutral
1haxwva,"China targets Nvidia with antitrust probe, escalates US chip tensions ",,2024-12-10 09:17:59,13,2,https://www.reuters.com/technology/china-investigates-nvidia-over-suspected-violation-antimonopoly-law-2024-12-09/,,"{'textblob_score': 0.0, 'vader_score': 0.0, 'sentiment_category': 'Neutral'}",0.0,0.0,Neutral
1hacw1f,TikTok asks court to pause law that could shut down app in U.S. next month,,2024-12-09 15:57:11,282,141,https://www.washingtonpost.com/technology/2024/12/09/tiktok-ban-court-injunction/,,"{'textblob_score': 0.0, 'vader_score': 0.0, 'sentiment_category': 'Neutral'}",0.0,0.0,Neutral
1hammha,"As TikTok files emergency motion to stop US ban, brands & creators are eyeing the door — Instagram Reels and YouTube Shorts poise to capitalise on migration",,2024-12-09 22:40:03,74,40,https://www.thedrum.com/news/2024/12/09/tiktok-files-emergency-motion-stop-us-ban-brands-creators-are-eyeing-the-door,,"{'textblob_score': 0.0, 'vader_score': 0.0, 'sentiment_category': 'Neutral'}",0.0,0.0,Neutral
1hb34n5,Google claims quantum computing milestone — but the tech can't solve real-world problems yet,,2024-12-10 14:36:06,5,12,https://www.cnbc.com/2024/12/10/google-claims-quantum-milestone-but-cant-solve-real-world-problems-.html,,"{'textblob_score': 0.0, 'vader_score': 0.0, 'sentiment_category': 'Neutral'}",0.0,0.0,Neutral
1h9zu21,Google CEO: AI development is finally slowing down—‘the low-hanging fruit is gone’,,2024-12-09 02:47:40,2910,571,https://www.cnbc.com/2024/12/08/google-ceo-sundar-pichai-ai-development-is-finally-slowing-down.html,,"{'textblob_score': 0.0, 'vader_score': 0.0, 'sentiment_category': 'Neutral'}",0.0,0.0,Neutral
1h9pqjd,Return-to-work mandates are an invisible pay cut,,2024-12-08 18:49:39,23631,1054,https://www.washingtonpost.com/opinions/2024/12/06/return-to-work-mandate-pay-cut/,,"{'textblob_score': 0.0, 'vader_score': 0.0, 'sentiment_category': 'Neutral'}",0.0,0.0,Neutral
1hasux3,"Israeli wave energy project draws interest from Qatar, Saudi Arabia and even Iran",,2024-12-10 03:46:48,27,1,https://www.timesofisrael.com/israeli-wave-energy-project-draws-interest-from-qatar-saudi-arabia-and-even-iran/,,"{'textblob_score': 0.0, 'vader_score': 0.0, 'sentiment_category': 'Neutral'}",0.0,0.0,Neutral
1hane2z,How Chinese insiders are stealing data scooped up by President Xi's national surveillance system,,2024-12-09 23:14:59,60,2,https://www.theregister.com/2024/12/08/chinese_insiders_stealing_data/?td=rt-3a,,"{'textblob_score': 0.0, 'vader_score': 0.0, 'sentiment_category': 'Neutral'}",0.0,0.0,Neutral
1ha92dt,Chinese Carmakers Are Taking Mexico by Storm While Eyeing U.S.,,2024-12-09 12:54:15,373,101,https://www.nytimes.com/2024/12/09/business/china-mexico-ev-electric-vehicles.html,,"{'textblob_score': 0.0, 'vader_score': 0.0, 'sentiment_category': 'Neutral'}",0.0,0.0,Neutral
1ha7qkh,US says Chinese hackers are still lurking in American phone networks,,2024-12-09 11:33:59,475,40,https://techcrunch.com/2024/12/04/fbi-recommends-encrypted-messaging-apps-combat-chinese-hackers/,,"{'textblob_score': 0.0, 'vader_score': 0.0, 'sentiment_category': 'Neutral'}",0.0,0.0,Neutral
1hauk55,The Age of Chiplets is Upon Us - EE Times,,2024-12-10 05:21:43,17,1,https://www.eetimes.com/the-age-of-chiplets-is-upon-us/,,"{'textblob_score': 0.0, 'vader_score': 0.0, 'sentiment_category': 'Neutral'}",0.0,0.0,Neutral
1hbtn2o,Popular Science declares Vision Pro to be gadget of the year,,2024-12-11 13:38:03,0,12,https://9to5mac.com/2024/12/10/popular-science-declares-vision-pro-to-be-gadget-of-the-year/,,"{'textblob_score': 0.0, 'vader_score': 0.0, 'sentiment_category': 'Neutral'}",0.0,0.0,Neutral
1hapms1,Quantum Computers Cross Critical Error Threshold | Quanta Magazine,,2024-12-10 01:00:26,31,5,https://www.quantamagazine.org/quantum-computers-cross-critical-error-threshold-20241209/,,"{'textblob_score': 0.0, 'vader_score': 0.0, 'sentiment_category': 'Neutral'}",0.0,0.0,Neutral
1hbpu52,"China’s ‘explosive’ ironmaking breakthrough achieves 3,600-fold productivity boost",,2024-12-11 09:33:02,0,5,https://www.scmp.com/news/china/science/article/3289441/chinas-explosive-ironmaking-breakthrough-achieves-3600-fold-productivity-boost,,"{'textblob_score': 0.0, 'vader_score': 0.0, 'sentiment_category': 'Neutral'}",0.0,0.0,Neutral
1haw829,AI robot companions for kids go dark as company shutters.,,2024-12-10 07:09:27,9,3,https://www.theverge.com/2024/12/9/24317477/ai-robot-companions-for-kids-go-dark-as-company-shutters,,"{'textblob_score': 0.0, 'vader_score': 0.0, 'sentiment_category': 'Neutral'}",0.0,0.0,Neutral
1hayyah,Nvidia shares slide after China launches probe of suspected anti-monopoly violations,,2024-12-10 10:37:13,2,1,https://nypost.com/2024/12/09/business/nvidia-shares-slide-after-china-launches-probe-of-suspected-anti-monopoly-violations/?utm_medium=social&utm_source=twitter&utm_campaign=nypost,,"{'textblob_score': 0.0, 'vader_score': 0.0, 'sentiment_category': 'Neutral'}",0.0,0.0,Neutral
1hbpczt,Google says its new quantum chip indicates that multiple universes exist,,2024-12-11 08:55:23,0,17,https://techcrunch.com/2024/12/10/google-says-its-new-quantum-chip-indicates-that-multiple-universes-exist/,,"{'textblob_score': 0.0, 'vader_score': 0.0, 'sentiment_category': 'Neutral'}",0.0,0.0,Neutral
1ha7wvx,Covert Facebook Network Found to Be Targeting Romanian Voters,,2024-12-09 11:45:30,234,3,https://www.bloomberg.com/news/articles/2024-12-09/covert-facebook-network-found-to-be-targeting-romanian-voters,,"{'textblob_score': 0.0, 'vader_score': 0.0, 'sentiment_category': 'Neutral'}",0.0,0.0,Neutral
1ha99tq,Covert Facebook Network Found to Be Targeting Romanian Voters,,2024-12-09 13:05:09,180,6,https://www.bnnbloomberg.ca/business/company-news/2024/12/09/covert-facebook-network-found-to-be-targeting-romanian-voters/,,"{'textblob_score': 0.0, 'vader_score': 0.0, 'sentiment_category': 'Neutral'}",0.0,0.0,Neutral
1haz20f,China’s chip making shows progress with new EUV patent despite US sanctions,,2024-12-10 10:44:35,1,2,https://www.scmp.com/tech/big-tech/article/3278235/chinese-chip-making-shows-progress-new-euv-patent-domestic-lithography-champion,,"{'textblob_score': 0.0, 'vader_score': 0.0, 'sentiment_category': 'Neutral'}",0.0,0.0,Neutral
1haiifw,Oceanographers record the largest predation event ever observed in the ocean,,2024-12-09 19:48:00,45,9,https://news.mit.edu/2024/oceanographers-record-largest-predation-event-ever-observed-1029,,"{'textblob_score': 0.0, 'vader_score': 0.0, 'sentiment_category': 'Neutral'}",0.0,0.0,Neutral
1har1nq,Spotify has disabled Car Thing streaming devices,,2024-12-10 02:11:36,15,11,https://techcrunch.com/2024/12/09/spotify-car-thing-units-are-officially-disabled/,,"{'textblob_score': 0.0, 'vader_score': 0.0, 'sentiment_category': 'Neutral'}",0.0,0.0,Neutral
1habvxy,Latest James Webb data hints at new physics in Universe’s expansion | These latest findings further support the Hubble Space Telescope's prior expansion rate measurements.,,2024-12-09 15:12:22,97,9,https://arstechnica.com/science/2024/12/latest-james-webb-data-hints-at-new-physics-in-universes-expansion/,,"{'textblob_score': 0.0, 'vader_score': 0.0, 'sentiment_category': 'Neutral'}",0.0,0.0,Neutral
1ha8487,China Targets Nvidia For Potential Breaches of Anti-Monopoly Law ,,2024-12-09 11:58:51,153,69,https://www.bloomberg.com/news/articles/2024-12-09/china-targets-nvidia-for-potential-breaches-of-anti-monopoly-law,,"{'textblob_score': 0.0, 'vader_score': 0.0, 'sentiment_category': 'Neutral'}",0.0,0.0,Neutral
1hadahu,Google says it has cracked a quantum computing challenge with new chip,,2024-12-09 16:14:00,69,16,https://www.yahoo.com/tech/google-says-cracked-quantum-computing-160249632.html,,"{'textblob_score': 0.0, 'vader_score': 0.0, 'sentiment_category': 'Neutral'}",0.0,0.0,Neutral
1h9wyml,"Badass Russian techie outsmarts FSB, flees Putinland all while being tracked with spyware",,2024-12-09 00:18:35,1281,40,https://www.theregister.com/2024/12/06/badass_russian_techie_outsmarts_fsb/?td=rt-3a,,"{'textblob_score': 0.0, 'vader_score': 0.0, 'sentiment_category': 'Neutral'}",0.0,0.0,Neutral
1hah0do,"Marco Grossi, the man behind the success of iLovePDF | The company that cuts, pastes, compresses and solves everything in the universe of this document format was the brainchild of a design student from Barcelona. Today it employs 43 people and its website is one of the 50 most visited in the world",,2024-12-09 18:46:13,41,7,https://english.elpais.com/technology/2024-12-08/marco-grossi-the-man-behind-the-success-of-ilovepdf.html,,"{'textblob_score': 0.0, 'vader_score': 0.0, 'sentiment_category': 'Neutral'}",0.0,0.0,Neutral
1hbgb5o,"‘My name is Taqqiq, I can read text’: Microsoft Translator adds Inuktitut text-to-speech",,2024-12-11 00:04:00,0,3,https://nunatsiaq.com/stories/article/my-name-is-taqqiq-i-can-read-text-microsoft-translator-adds-inuktitut-text-to-speech/,,"{'textblob_score': 0.0, 'vader_score': 0.0, 'sentiment_category': 'Neutral'}",0.0,0.0,Neutral
1hb2bob,"Rheinmetall, Auterion to Develop Standardized Software for Military Drones
",,2024-12-10 13:57:58,1,3,https://www.wsj.com/world/europe/rheinmetall-auterion-to-develop-standardized-software-for-military-drones-017e966d?mod=tech_lead_pos3,,"{'textblob_score': 0.0, 'vader_score': 0.0, 'sentiment_category': 'Neutral'}",0.0,0.0,Neutral
