id,title,text,created_at,score,num_comments,url,cleaned_text,sentiment,textblob_score,vader_score,sentiment_category
1hckbgs,"Firefox, one of the first “Do Not Track” supporters, no longer offers it",,2024-12-12 12:46:00,1794,102,https://arstechnica.com/gadgets/2024/12/firefox-one-of-the-first-do-not-track-supporters-no-longer-offers-it/,,"{'textblob_score': 0.0, 'vader_score': 0.0, 'sentiment_category': 'Neutral'}",0.0,0.0,Neutral
1hcgqr0,FBI says it has no answers for drones seen over New Jersey,,2024-12-12 08:34:43,3168,505,https://www.newsnationnow.com/us-news/northeast/fbi-no-answers-drones-new-jersey/,,"{'textblob_score': 0.0, 'vader_score': 0.0, 'sentiment_category': 'Neutral'}",0.0,0.0,Neutral
1hc78n9,Companies try to stop online support for CEO killer suspect,,2024-12-11 23:24:17,41979,2852,https://edition.cnn.com/2024/12/10/business/deny-defend-dispose-merchandise-amazon-ceo-shooting/index.html,,"{'textblob_score': 0.0, 'vader_score': 0.0, 'sentiment_category': 'Neutral'}",0.0,0.0,Neutral
1hcnlck,Trump’s Pick for FTC Chair is Ready to Undo the Good Things From Lina Khan,,2024-12-12 15:30:44,539,58,https://gizmodo.com/trumps-pick-for-ftc-chair-is-ready-to-undo-the-good-things-from-lina-khan-2000537614,,"{'textblob_score': 0.0, 'vader_score': 0.0, 'sentiment_category': 'Neutral'}",0.0,0.0,Neutral
1hclof4,Russia takes unusual route to hack Starlink-connected devices in Ukraine,,2024-12-12 13:59:44,599,71,https://arstechnica.com/security/2024/12/russia-takes-unusual-route-to-hack-starlink-connected-devices-in-ukraine/,,"{'textblob_score': 0.0, 'vader_score': 0.0, 'sentiment_category': 'Neutral'}",0.0,0.0,Neutral
1hc5wic,Two Teens Indicted for Creating Hundreds of Deepfake Porn Images of Classmates,,2024-12-11 22:24:48,9948,1157,https://www.forbes.com/sites/cyrusfarivar/2024/12/11/almost-half-the-girls-at-this-school-were-targets-of-ai-porn-their-ex-classmates-have-now-been-indicted/,,"{'textblob_score': 0.0, 'vader_score': 0.0, 'sentiment_category': 'Neutral'}",0.0,0.0,Neutral
1hce0qj,"Meta donates $1 million to Trump’s inaugural fund in latest step to mend relationship
",,2024-12-12 05:21:32,807,272,https://www.cnn.com/2024/12/11/tech/meta-trump-donation-hnk-intl/index.html,,"{'textblob_score': 0.0, 'vader_score': 0.0, 'sentiment_category': 'Neutral'}",0.0,0.0,Neutral
1hcmuz5,Homeland Security shares new details of mysterious drone flights over New Jersey,,2024-12-12 14:57:27,136,111,https://www.nbcnewyork.com/new-jersey/drone-sightings-mystery-update-nj/6063296/,,"{'textblob_score': 0.0, 'vader_score': 0.0, 'sentiment_category': 'Neutral'}",0.0,0.0,Neutral
1hco5oh,Mark Zuckerberg’s Meta Donates $1 Million to Trump’s Inaugural Fund (Wall Street Journal),,2024-12-12 15:56:17,104,50,https://www.wsj.com/tech/mark-zuckerbergs-meta-donates-1-million-to-trumps-inaugural-fund-32a999c1?st=fmz7tP&reflink=article_copyURL_share,,"{'textblob_score': 0.0, 'vader_score': 0.0, 'sentiment_category': 'Neutral'}",0.0,0.0,Neutral
1hcnibc,"YouTube TV Hikes Price $10 to $82.99
",,2024-12-12 15:26:44,120,141,https://www.thewrap.com/youtube-tv-price-increase/,,"{'textblob_score': 0.0, 'vader_score': 0.0, 'sentiment_category': 'Neutral'}",0.0,0.0,Neutral
1hcgpkz,Encryption is non-negotiable: open letter to EU to not undermine privacy.,,2024-12-12 08:31:50,295,14,https://tuta.com/blog/open-letter-eu-privacy,,"{'textblob_score': 0.0, 'vader_score': 0.0, 'sentiment_category': 'Neutral'}",0.0,0.0,Neutral
1hciexh,"U.S. online gambling losses to surpass $1 trillion by 2028, group says ",,2024-12-12 10:43:12,196,39,https://www.upi.com/Top_News/US/2024/12/11/US-WHO-Campaign-for-Fairer-Gambling-online-loss-addiction/9601733943145/,,"{'textblob_score': 0.0, 'vader_score': 0.0, 'sentiment_category': 'Neutral'}",0.0,0.0,Neutral
1hc905u,"Mysterious SUV-sized drones may have blocked medical helicopter | Locals and police continue to report unidentified aerial vehicles across Pennsylvania, New Jersey, and New York.",,2024-12-12 00:50:26,1181,277,https://www.popsci.com/technology/new-jersey-drones/,,"{'textblob_score': 0.0, 'vader_score': 0.0, 'sentiment_category': 'Neutral'}",0.0,0.0,Neutral
1hc448v,"LG stops making Blu-ray players, marking the end of an era — limited units remain while inventory lasts | Digital streaming is displacing the last remnants of physical media.",,2024-12-11 21:07:32,2346,357,https://www.tomshardware.com/tech-industry/lg-stops-making-blu-ray-players-marking-the-end-of-an-era-limited-units-remain-while-inventory-lasts,,"{'textblob_score': 0.0, 'vader_score': 0.0, 'sentiment_category': 'Neutral'}",0.0,0.0,Neutral
1hbuqra,"Indian police demand Starlink reveal buyer of device found in $4.2 billion drug bust | Smugglers were caught with 13,227 pounds of meth",,2024-12-11 14:31:52,6166,176,https://www.techspot.com/news/105916-indian-police-demand-starlink-reveal-buyer-device-found.html,,"{'textblob_score': 0.0, 'vader_score': 0.0, 'sentiment_category': 'Neutral'}",0.0,0.0,Neutral
1hc5jux,"Incoming FTC Chair: I will stop investigations that I falsely claim are politically motivated, and launch my own politically motivated investigations",,2024-12-11 22:09:29,1364,51,https://www.techdirt.com/2024/12/11/incoming-ftc-chair-i-will-stop-all-these-investigations-that-i-falsely-claim-are-politically-motivated-in-order-to-launch-my-own-openly-politically-motivated-investigations/,,"{'textblob_score': 0.0, 'vader_score': 0.0, 'sentiment_category': 'Neutral'}",0.0,0.0,Neutral
1hchbjr,"Pentagon says mystery drones over New Jersey are 'not US military,' not likely foreign | TechCrunch",,2024-12-12 09:20:36,171,117,https://techcrunch.com/2024/12/11/pentagon-says-mystery-drones-over-new-jersey-are-not-us-military-not-likely-foreign/?guccounter=1&guce_referrer=aHR0cHM6Ly93d3cuZ29vZ2xlLmNvbS8&guce_referrer_sig=AQAAAEPdqMTGF27gnxq-GLVJkqdq2vD5guPHK8x62OITfp6-uMHZxkiXKVYa_xltG3lWehBwkhWLRxdbaJ7NWIyC4llcJ0fA-LLwDrc53VyU-gSd9JGcAv858P2UcsAykRSvN2Lu529-rpilwmBL6PcCVfAOQbGvNvIj_DiQtNcFwWte,,"{'textblob_score': 0.0, 'vader_score': 0.0, 'sentiment_category': 'Neutral'}",0.0,0.0,Neutral
1hciypz,Greece to Introduce Social Media Restrictions for Young Users,,2024-12-12 11:20:36,101,4,https://greekreporter.com/2024/12/11/greece-among-countries-set-social-media-restrictions-young-users/,,"{'textblob_score': 0.0, 'vader_score': 0.0, 'sentiment_category': 'Neutral'}",0.0,0.0,Neutral
1hcl5hi,"US firm beats Microsoft, Harvard with 50 entangled logical qubits in quantum computer | Records are tumbling in months as companies race to build fault tolerant quantum computers.",,2024-12-12 13:31:51,50,0,https://interestingengineering.com/innovation/50-logical-qubits-entangled-record-quantinuum,,"{'textblob_score': 0.0, 'vader_score': 0.0, 'sentiment_category': 'Neutral'}",0.0,0.0,Neutral
1hbw6u9,The Operators Behind Four Major Neo-Nazi X Accounts,,2024-12-11 15:37:21,2363,53,https://znetwork.org/znetarticle/the-operators-behind-four-major-neo-nazi-x-accounts/,,"{'textblob_score': 0.0, 'vader_score': 0.0, 'sentiment_category': 'Neutral'}",0.0,0.0,Neutral
1hcdm95,"Meta, TikTok and Google to be forced to pay for Australian news",,2024-12-12 04:57:58,181,26,https://www.theguardian.com/australia-news/2024/dec/12/meta-tiktok-and-google-to-be-forced-to-pay-for-australian-news,,"{'textblob_score': 0.0, 'vader_score': 0.0, 'sentiment_category': 'Neutral'}",0.0,0.0,Neutral
1hbwisp,"Russia Tests Cutting Off Access to Global Web, and VPNs Can't Get Around It",,2024-12-11 15:52:04,1815,296,https://www.pcmag.com/news/russia-tests-cutting-off-access-to-global-web-and-vpns-cant-get-around,,"{'textblob_score': 0.0, 'vader_score': 0.0, 'sentiment_category': 'Neutral'}",0.0,0.0,Neutral
1hbzyjr,"Instagram, Facebook, WhatsApp, and Threads are currently down in major Meta outage",,2024-12-11 18:14:46,1167,219,https://9to5mac.com/2024/12/11/instagram-facebook-whatsapp-and-threads-are-currently-down-in-major-meta-outage/,,"{'textblob_score': 0.0, 'vader_score': 0.0, 'sentiment_category': 'Neutral'}",0.0,0.0,Neutral
1hcjkib,Japanese publisher Kadokawa paid $3 million to Russia-linked hacker group after cyberattack,,2024-12-12 12:00:47,41,2,https://mainichi.jp/english/articles/20241212/p2g/00m/0na/035000c,,"{'textblob_score': 0.0, 'vader_score': 0.0, 'sentiment_category': 'Neutral'}",0.0,0.0,Neutral
1hbn654,Judge rejects sale of Alex Jones' Infowars to The Onion in dispute over bankruptcy auction,,2024-12-11 06:12:47,9650,864,https://apnews.com/article/infowars-onion-6bbdfb7d8d87b2f114570fcde4e39930,,"{'textblob_score': 0.0, 'vader_score': 0.0, 'sentiment_category': 'Neutral'}",0.0,0.0,Neutral
1hc5sol,It sure looks like OpenAI trained Sora on game content — and legal experts say that could be a problem ,,2024-12-11 22:20:05,393,137,https://techcrunch.com/2024/12/11/it-sure-looks-like-openai-trained-sora-on-game-content-and-legal-experts-say-that-could-be-a-problem/?utm_source=dlvr.it&utm_medium=bluesky,,"{'textblob_score': 0.0, 'vader_score': 0.0, 'sentiment_category': 'Neutral'}",0.0,0.0,Neutral
1hcj141,"US to cap countries’ advanced chip access, with China in sights: sources",,2024-12-12 11:25:11,37,8,https://www.scmp.com/tech/tech-war/article/3290435/chip-war-us-plans-cap-countries-semiconductor-access-targeting-chinese-smuggling,,"{'textblob_score': 0.0, 'vader_score': 0.0, 'sentiment_category': 'Neutral'}",0.0,0.0,Neutral
1hcbpm7,Blocking Chinese spies from intercepting calls? Sen. Wyden blasts FCC's 'failure' amid Salt Typhoon hacks,,2024-12-12 03:08:38,158,6,https://www.theregister.com/2024/12/11/telecom_cybersecurity_standards/,,"{'textblob_score': 0.0, 'vader_score': 0.0, 'sentiment_category': 'Neutral'}",0.0,0.0,Neutral
1hc8wq9,"Pentagon announces new AI office as it looks to deploy autonomous weapons
",,2024-12-12 00:45:39,219,78,https://thehill.com/policy/defense/5034805-artificial-intelligence-military/,,"{'textblob_score': 0.0, 'vader_score': 0.0, 'sentiment_category': 'Neutral'}",0.0,0.0,Neutral
1hbur1h,YouTube Says Viewers Streamed Over 1 Billion Hours Daily From Their Living Rooms in 2024,,2024-12-11 14:32:14,1046,195,https://www.thewrap.com/youtube-living-room-viewership-1-billion-hours-daily-tv-2024/,,"{'textblob_score': 0.0, 'vader_score': 0.0, 'sentiment_category': 'Neutral'}",0.0,0.0,Neutral
1hbw4mb,"Amazon starts selling Hyundai cars, more brands next year | Amazon Autos has gone live in 48 US cities",,2024-12-11 15:34:43,862,220,https://arstechnica.com/cars/2024/12/amazon-gets-into-the-car-sales-game-starting-with-hyundai/,,"{'textblob_score': 0.0, 'vader_score': 0.0, 'sentiment_category': 'Neutral'}",0.0,0.0,Neutral
1hco83g,You can now use AirTags to expedite a lost luggage reunion through United’s mobile app,,2024-12-12 15:59:18,9,4,https://www.theverge.com/2024/12/12/24319503/apple-airtag-find-my-network-share-item-location-united-airlines-lost-bag-luggage,,"{'textblob_score': 0.0, 'vader_score': 0.0, 'sentiment_category': 'Neutral'}",0.0,0.0,Neutral
1hcldj8,Report: Google told FTC Microsoft’s OpenAI deal is killing AI competition,,2024-12-12 13:43:50,13,3,https://arstechnica.com/tech-policy/2024/12/report-microsofts-exclusive-deal-with-openai-harms-competition-google-told-ftc/,,"{'textblob_score': 0.0, 'vader_score': 0.0, 'sentiment_category': 'Neutral'}",0.0,0.0,Neutral
1hcmrpk,BeReal accused of annoying users into sharing their data,,2024-12-12 14:53:00,8,2,https://www.engadget.com/big-tech/bereal-accused-of-annoying-users-into-sharing-their-data-160024570.html,,"{'textblob_score': 0.0, 'vader_score': 0.0, 'sentiment_category': 'Neutral'}",0.0,0.0,Neutral
1hckg3t,Nvidia Denies Rumors It Will Cut Supplies To China,,2024-12-12 12:53:15,10,3,https://asia.nikkei.com/Business/Tech/Semiconductors/Nvidia-denies-rumours-it-will-cut-supplies-to-China,,"{'textblob_score': 0.0, 'vader_score': 0.0, 'sentiment_category': 'Neutral'}",0.0,0.0,Neutral
1hbs6fs,Startup will brick $800 emotional support robot for kids without refunds | Embodied says it will try to refund recent purchases but makes no promises.,,2024-12-11 12:17:13,1057,135,https://arstechnica.com/gadgets/2024/12/startup-will-brick-800-emotional-support-robot-for-kids-without-refunds/,,"{'textblob_score': 0.0, 'vader_score': 0.0, 'sentiment_category': 'Neutral'}",0.0,0.0,Neutral
1hcoauy,"Google announces Android XR, a new OS for headsets and smart glasses",,2024-12-12 16:02:21,6,3,https://www.theverge.com/2024/12/12/24319538/google-android-xr-ar-vr-smart-glasses,,"{'textblob_score': 0.0, 'vader_score': 0.0, 'sentiment_category': 'Neutral'}",0.0,0.0,Neutral
1hbwsnm,Steam has just beaten its concurrent players record once again with a whopping 39.2 million at one time | And there are a few big launches to thank.,,2024-12-11 16:03:42,474,39,https://www.pcgamer.com/software/steam-has-just-beaten-its-concurrent-players-record-once-again-with-a-whopping-39-2-million-at-one-time/,,"{'textblob_score': 0.0, 'vader_score': 0.0, 'sentiment_category': 'Neutral'}",0.0,0.0,Neutral
1hcnlcf,Why You Might Not Need to Add ‘Reddit’ to Your Google Searches Anymore,,2024-12-12 15:30:43,6,0,https://lifehacker.com/tech/reddit-has-a-new-ai-search-tool?ref=thefuturist,,"{'textblob_score': 0.0, 'vader_score': 0.0, 'sentiment_category': 'Neutral'}",0.0,0.0,Neutral
1hbdlmn,Suspect in CEO’s killing had discussed his health struggles on Reddit,,2024-12-10 22:01:49,24203,2511,https://www.nytimes.com/2024/12/10/nyregion/luigi-mangione-health-issues-reddit.html,,"{'textblob_score': 0.0, 'vader_score': 0.0, 'sentiment_category': 'Neutral'}",0.0,0.0,Neutral
1hbw8og,Wyden proposes bill to secure US telecoms after Salt Typhoon hacks,,2024-12-11 15:39:40,433,23,https://www.bleepingcomputer.com/news/security/wyden-proposes-bill-to-secure-us-telecoms-after-salt-typhoon-hacks/,,"{'textblob_score': 0.0, 'vader_score': 0.0, 'sentiment_category': 'Neutral'}",0.0,0.0,Neutral
1hbzgkl,Designer Babies Are Teenagers Now—and Some of Them Need Therapy Because of It,,2024-12-11 17:54:21,234,122,https://www.wired.com/story/your-next-job-designer-baby-therapist/,,"{'textblob_score': 0.0, 'vader_score': 0.0, 'sentiment_category': 'Neutral'}",0.0,0.0,Neutral
1hcmr5z,IBM Boasts Industry-Leading Photonics to Cut AI Training Speed,,2024-12-12 14:52:15,5,0,https://www.eetimes.com/ibm-boasts-industry-leading-photonics-to-cut-ai-training-speed/,,"{'textblob_score': 0.0, 'vader_score': 0.0, 'sentiment_category': 'Neutral'}",0.0,0.0,Neutral
1hcgeq8,Chatbot 'encouraged teen to kill parents over screen time limit',,2024-12-12 08:08:44,15,14,https://www.bbc.com/news/articles/cd605e48q1vo,,"{'textblob_score': 0.0, 'vader_score': 0.0, 'sentiment_category': 'Neutral'}",0.0,0.0,Neutral
1hbc4wz,"Boeing cancels its workplace surveillance program, will be ‘removing the sensors that have been installed’ — less than a day after The Seattle Times requested comment about leaked information",,2024-12-10 20:59:37,8717,160,https://www.seattletimes.com/business/boeing-aerospace/boeing-cancels-its-workplace-surveillance-program-will-remove-sensors/,,"{'textblob_score': 0.0, 'vader_score': 0.0, 'sentiment_category': 'Neutral'}",0.0,0.0,Neutral
1hc73pe,Open source maintainers are drowning in junk bug reports written by AI,,2024-12-11 23:17:51,63,5,https://www.theregister.com/2024/12/10/ai_slop_bug_reports/?td=rt-4a,,"{'textblob_score': 0.0, 'vader_score': 0.0, 'sentiment_category': 'Neutral'}",0.0,0.0,Neutral
1hb6ydi,Trump's DOJ secretly obtained phone and text message logs of 43 congressional staffers and 2 members of Congress,,2024-12-10 17:22:22,18418,706,https://www.nbcnews.com/politics/justice-department/trumps-doj-secretly-obtained-phone-text-message-logs-43-congressional-rcna183610,,"{'textblob_score': 0.0, 'vader_score': 0.0, 'sentiment_category': 'Neutral'}",0.0,0.0,Neutral
1hbrd09,Philippines constructing $3bn ‘world’s largest’ integrated solar/battery facility,,2024-12-11 11:24:45,393,10,https://www.constructionbriefing.com/news/philippines-delivers-contracts-for-us3b-worlds-largest-integrated-solar-battery-facility/8043479.article,,"{'textblob_score': 0.0, 'vader_score': 0.0, 'sentiment_category': 'Neutral'}",0.0,0.0,Neutral
1hbup40,"B.C. lawsuit claims Electronic Arts video game ""loot boxes"" are deceptive",,2024-12-11 14:29:39,223,12,"https://vancouversun.com/news/bc-lawsuit-electronic-arts-loot-boxes-deceptive#:~:text=According%20to%20legal%20firm%20Slater,repeated%20purchases%20of%20loot%20boxes.%E2%80%9D",,"{'textblob_score': 0.0, 'vader_score': 0.0, 'sentiment_category': 'Neutral'}",0.0,0.0,Neutral
1hco1zd,Palmer Luckey’s defense tech company will make next-gen military aircraft with Archer | A hybrid vertical takeoff and landing aircraft,,2024-12-12 15:51:42,2,1,https://www.theverge.com/2024/12/12/24319087/anduril-archer-vtol-aircraft-military-investment,,"{'textblob_score': 0.0, 'vader_score': 0.0, 'sentiment_category': 'Neutral'}",0.0,0.0,Neutral
1hbon6u,Valve is now selling refurbished Steam Deck OLEDs starting at $439,,2024-12-11 07:59:14,628,36,https://www.theverge.com/2024/12/10/24318367/valve-refurbished-steam-deck-oled,,"{'textblob_score': 0.0, 'vader_score': 0.0, 'sentiment_category': 'Neutral'}",0.0,0.0,Neutral
1hcbehv,"Fujitsu flaunts massive 144-core Monaka Arm chip — 2nm and 5nm chiplets, 3D-stacked CPU cores over memory",,2024-12-12 02:52:08,16,1,https://www.tomshardware.com/pc-components/cpus/fujitsu-flaunts-144-core-monaka-cpu-2nm-and-5nm-chiplets-soic-and-cowos-packaging,,"{'textblob_score': 0.0, 'vader_score': 0.0, 'sentiment_category': 'Neutral'}",0.0,0.0,Neutral
1hclrln,Microsoft gives Alt+Space shortcut over to Copilot,,2024-12-12 14:03:44,1,2,https://www.theregister.com/2024/12/11/microsoft_copilot_keyboard_shortcut/?td=rt-3a,,"{'textblob_score': 0.0, 'vader_score': 0.0, 'sentiment_category': 'Neutral'}",0.0,0.0,Neutral
1hcaocq,Tech billionaires prepare to invade the Pentagon,,2024-12-12 02:14:23,16,11,https://www.politico.com/news/2024/12/10/silicon-valley-takes-over-pentagon-00193576,,"{'textblob_score': 0.0, 'vader_score': 0.0, 'sentiment_category': 'Neutral'}",0.0,0.0,Neutral
1hc15lj,"Facebook, Instagram, and Threads are down - The Verge",,2024-12-11 19:03:47,56,25,https://www.theverge.com/2024/12/11/24318908/facebook-instagram-threads-down-outage-meta,,"{'textblob_score': 0.0, 'vader_score': 0.0, 'sentiment_category': 'Neutral'}",0.0,0.0,Neutral
1hcp56s,YouTube “Enhances” Comment Section With AI-Generated Nonsense,,2024-12-12 16:39:24,1,1,https://www.404media.co/youtube-enhances-comment-section-with-ai-generated-nonsense/,,"{'textblob_score': 0.0, 'vader_score': 0.0, 'sentiment_category': 'Neutral'}",0.0,0.0,Neutral
1hcnuw0,"Hands on with Project Astra, Google's see-all assistant",,2024-12-12 15:42:55,1,0,https://www.axios.com/2024/12/11/google-project-astra-hands-on,,"{'textblob_score': 0.0, 'vader_score': 0.0, 'sentiment_category': 'Neutral'}",0.0,0.0,Neutral
1hbvfs2,Krispy Kreme is latest to report a cyberattack that’s hampering its business,,2024-12-11 15:03:43,88,13,https://www.marketwatch.com/story/krispy-kreme-is-latest-to-report-a-cyberattack-thats-hampering-its-business-5d58a290,,"{'textblob_score': 0.0, 'vader_score': 0.0, 'sentiment_category': 'Neutral'}",0.0,0.0,Neutral
1hc00wn,"With promising early data in triple negative breast cancer, a new bispecific heats up",,2024-12-11 18:17:23,46,0,https://www.statnews.com/2024/12/10/triple-negative-breast-cancer-biontech-immunotherapy-bispecific/,,"{'textblob_score': 0.0, 'vader_score': 0.0, 'sentiment_category': 'Neutral'}",0.0,0.0,Neutral
1hc52ay,"Microsoft now allows Windows 11 installations on unsupported hardware, devices.",,2024-12-11 21:48:32,26,14,https://www.techspot.com/news/105894-microsoft-now-officially-allows-windows-11-installation-unsupported.html,,"{'textblob_score': 0.0, 'vader_score': 0.0, 'sentiment_category': 'Neutral'}",0.0,0.0,Neutral
1hc9lvp,World-1st tubular 'mini intestine' crafted by Japan researchers from human iPS cells  ,,2024-12-12 01:19:49,10,0,https://mainichi.jp/english/articles/20241211/p2a/00m/0sc/008000c,,"{'textblob_score': 0.0, 'vader_score': 0.0, 'sentiment_category': 'Neutral'}",0.0,0.0,Neutral
1hcmo2l,Trump May Split Up America's Cyber Agencies,,2024-12-12 14:48:09,0,17,https://gizmodo.com/trump-may-split-up-americas-cyber-agencies-2000537657,,"{'textblob_score': 0.0, 'vader_score': 0.0, 'sentiment_category': 'Neutral'}",0.0,0.0,Neutral
1hc75cs,"GM is giving up on Cruise robotaxis, pivots to personal autonomous vehicles",,2024-12-11 23:20:01,16,5,https://techcrunch.com/2024/12/11/gm-is-giving-up-on-cruise-robotaxis-pivots-to-personal-autonomous-vehicles/,,"{'textblob_score': 0.0, 'vader_score': 0.0, 'sentiment_category': 'Neutral'}",0.0,0.0,Neutral
1hbrqas,"PeerTube, the Open-Source YouTube, Now Has Mobile Apps",,2024-12-11 11:49:18,142,0,https://www.howtogeek.com/peertube-now-has-mobile-apps/,,"{'textblob_score': 0.0, 'vader_score': 0.0, 'sentiment_category': 'Neutral'}",0.0,0.0,Neutral
1hbg8nr,"Proposed merger of Kroger and Albertsons is halted by federal, state judges",,2024-12-11 00:01:02,1223,16,https://apnews.com/article/kroger-albertsons-merger-court-decision-41263bd9137d5046a642e7d26e98cdfc,,"{'textblob_score': 0.0, 'vader_score': 0.0, 'sentiment_category': 'Neutral'}",0.0,0.0,Neutral
1hbzbtg,Hong Kong police consider using drones for patrols as rules are reviewed,,2024-12-11 17:49:00,47,1,https://www.scmp.com/news/hong-kong/law-and-crime/article/3290356/hong-kong-police-consider-using-drones-patrol-streets-authorities-review-rules,,"{'textblob_score': 0.0, 'vader_score': 0.0, 'sentiment_category': 'Neutral'}",0.0,0.0,Neutral
1hbft3p,US military grounds entire Osprey tiltrotor fleet,,2024-12-10 23:41:15,1265,122,https://www.theregister.com/2024/12/10/us_military_osprey/,,"{'textblob_score': 0.0, 'vader_score': 0.0, 'sentiment_category': 'Neutral'}",0.0,0.0,Neutral
1hcly5m,US solar industry downplays climate in strategy for Trump era,,2024-12-12 14:12:42,0,5,https://www.reuters.com/business/energy/us-solar-industry-downplays-climate-strategy-trump-era-2024-12-12/,,"{'textblob_score': 0.0, 'vader_score': 0.0, 'sentiment_category': 'Neutral'}",0.0,0.0,Neutral
1hchvho,Mozilla removing Do Not Track option from Firefox 135,,2024-12-12 10:03:33,3,4,https://www.theregister.com/2024/12/12/firefox_do_not_track/,,"{'textblob_score': 0.0, 'vader_score': 0.0, 'sentiment_category': 'Neutral'}",0.0,0.0,Neutral
1hckbr5,Conspiracy theories overwhelm Reserve Bank submissions,,2024-12-12 12:46:30,0,1,https://newsroom.co.nz/2024/12/11/conspiracy-theories-overwhelm-reserve-bank-submissions/,,"{'textblob_score': 0.0, 'vader_score': 0.0, 'sentiment_category': 'Neutral'}",0.0,0.0,Neutral
1hc0ox0,"""Become Anyone 2.0"" is an LED display face-changing mask that lives up to its name.",,2024-12-11 18:45:02,26,21,https://www.techspot.com/news/105870-become-anyone-20-face-changing-mask-display-lives.html,,"{'textblob_score': 0.0, 'vader_score': 0.0, 'sentiment_category': 'Neutral'}",0.0,0.0,Neutral
1hc45gt,Supreme Court Dismisses NVIDIA’s Securities Fraud Appeal,,2024-12-11 21:09:01,17,2,https://www.scotusblog.com/2024/12/supreme-court-dismisses-nvidias-securities-fraud-appeal/,,"{'textblob_score': 0.0, 'vader_score': 0.0, 'sentiment_category': 'Neutral'}",0.0,0.0,Neutral
1hb1bgg,"Apple hit with $1.2B lawsuit after killing controversial CSAM-detecting tool. Apple knowingly ignoring child porn is a ""never-ending nightmare,"" lawsuit says.",,2024-12-10 13:06:04,6224,517,https://arstechnica.com/tech-policy/2024/12/thousands-of-child-sex-abuse-victims-sue-apple-for-lax-csam-reporting/,,"{'textblob_score': 0.0, 'vader_score': 0.0, 'sentiment_category': 'Neutral'}",0.0,0.0,Neutral
1hbnhrf,Cruise employees ‘blindsided’ by GM’s plan to end robotaxi program,,2024-12-11 06:34:54,223,37,https://techcrunch.com/2024/12/10/cruise-employees-blindsided-by-gms-plan-to-end-robotaxi-program/,,"{'textblob_score': 0.0, 'vader_score': 0.0, 'sentiment_category': 'Neutral'}",0.0,0.0,Neutral
1hc22jr,72pc accounts spreading anti-Bangladesh misinformation located in India: Rumor Scanner ,,2024-12-11 19:42:12,21,10,https://www.bssnews.net/news/229982,,"{'textblob_score': 0.0, 'vader_score': 0.0, 'sentiment_category': 'Neutral'}",0.0,0.0,Neutral
1hcbbwo,In GPU We Antitrust,,2024-12-12 02:48:21,3,0,https://www.nextplatform.com/2024/12/09/in-gpu-we-antitrust/,,"{'textblob_score': 0.0, 'vader_score': 0.0, 'sentiment_category': 'Neutral'}",0.0,0.0,Neutral
1haw3pb,Google steps in after McDonald's gets ‘review bombed’ over arrest in UnitedHealth CEO's murder,,2024-12-10 07:01:22,29125,2132,https://www.hindustantimes.com/world-news/google-steps-in-after-mcdonalds-get-review-bombed-over-arrest-in-unitedhealth-ceos-murder-101733809168783.html,,"{'textblob_score': 0.0, 'vader_score': 0.0, 'sentiment_category': 'Neutral'}",0.0,0.0,Neutral
1hbzx6x,"Watch Chinese security robot with wheels for feet scramble down hills and perform acrobatics - With wheels and a choice of two legs or four, the DEEP Robotics Lynx is capable of traversing tough terrain",,2024-12-11 18:13:12,19,11,https://www.livescience.com/technology/robotics/watch-chinese-security-robot-with-wheels-for-feet-scramble-down-hills-and-perform-acrobatics,,"{'textblob_score': 0.0, 'vader_score': 0.0, 'sentiment_category': 'Neutral'}",0.0,0.0,Neutral
1hbkg0e,Nvidia Is Now Too Powerful For Beijing To Constrain,,2024-12-11 03:32:25,206,24,https://www.bloomberg.com/news/newsletters/2024-12-10/nvidia-is-now-too-powerful-for-beijing-to-constrain?srnd=homepage-canada,,"{'textblob_score': 0.0, 'vader_score': 0.0, 'sentiment_category': 'Neutral'}",0.0,0.0,Neutral
1hbrv36,Spotify's Car Thing Accessory is Officially Dead,,2024-12-11 11:58:00,30,6,https://www.macrumors.com/2024/12/10/spotify-car-thing-officially-dead/,,"{'textblob_score': 0.0, 'vader_score': 0.0, 'sentiment_category': 'Neutral'}",0.0,0.0,Neutral
