id,title,text,created_at,score,num_comments,url,cleaned_text,sentiment,textblob_score,vader_score,sentiment_category
1hbcpm7,GM halts funding of robotaxi development by Cruise,,2024-12-10 21:23:34,442,101,https://www.cnbc.com/2024/12/10/gm-halts-funding-of-robotaxi-development-by-cruise.html,,"{'textblob_score': 0.0, 'vader_score': 0.0, 'sentiment_category': 'Neutral'}",0.0,0.0,Neutral
1hbwvgk,"Intel Arc B580 Battlemage GPU OpenCL/Vulkan Performance Leaks Out, 9% To 30% Faster Than A580",,2024-12-11 16:07:00,14,2,https://videocardz.com/newz/intel-arc-b580-battlemage-gpu-opencl-vulkan-performance-leaks-out-9-to-30-faster-than-a580,,"{'textblob_score': 0.0, 'vader_score': 0.0, 'sentiment_category': 'Neutral'}",0.0,0.0,Neutral
1hbou3j,"WordPress parent company must stop blocking WP Engine, judge rules",,2024-12-11 08:13:03,57,10,https://www.theverge.com/2024/12/10/24318350/automattic-restore-wp-engine-access-wordpress,,"{'textblob_score': 0.0, 'vader_score': 0.0, 'sentiment_category': 'Neutral'}",0.0,0.0,Neutral
1hbh96l,NASA says moon mission is further delayed but hopes to land astronauts before China,,2024-12-11 00:49:33,223,90,https://www.nbcnews.com/science/space/nasa-moon-mission-delayed-land-astronauts-before-china-rcna182941,,"{'textblob_score': 0.0, 'vader_score': 0.0, 'sentiment_category': 'Neutral'}",0.0,0.0,Neutral
1hb7c9b,Open source maintainers are drowning in junk bug reports written by AI - Python security developer-in-residence decries use of bots that 'cannot understand code',,2024-12-10 17:38:43,825,46,https://www.theregister.com/2024/12/10/ai_slop_bug_reports/,,"{'textblob_score': 0.0, 'vader_score': 0.0, 'sentiment_category': 'Neutral'}",0.0,0.0,Neutral
1hbqoql,"The blame game between governments, banks and tech companies over who foots the bill for cyber scams",,2024-12-11 10:37:02,27,4,https://www.ft.com/content/577dff0d-b7a0-4bc3-a1b1-3ca828e5ba18,,"{'textblob_score': 0.0, 'vader_score': 0.0, 'sentiment_category': 'Neutral'}",0.0,0.0,Neutral
1hbdpd8,Social Media Is a Growing Vehicle for Climate Misinformation.,,2024-12-10 22:06:16,255,42,https://insideclimatenews.org/news/10122024/todays-climate-climate-misinformation-social-media/,,"{'textblob_score': 0.0, 'vader_score': 0.0, 'sentiment_category': 'Neutral'}",0.0,0.0,Neutral
1hazuav,"Alarming amount of Texas Instrument chips found in Russian-based weapons in Ukraine — Russian military using third parties to purchase U.S-made chips | The U.S., and Texas Instruments, are struggling to crack down on slippery Russian-bound shipments.",,2024-12-10 11:38:16,1751,66,https://www.tomshardware.com/tech-industry/alarming-amount-of-texas-instrument-chips-found-in-russian-based-weapons-in-ukraine-russian-military-using-third-parties-to-purchase-u-s-made-chips,,"{'textblob_score': 0.0, 'vader_score': 0.0, 'sentiment_category': 'Neutral'}",0.0,0.0,Neutral
1hazjos,"How Russia-backed influencers meddled in Romania’s vote — Presidential election annulled after ‘illegal’ social media campaign deploys 100 paid influencers with 8 million followers on TikTok, Meta platforms",,2024-12-10 11:18:28,1612,135,https://www.ft.com/content/4b00e7ec-2c79-4313-b012-4f09f436f3ed,,"{'textblob_score': 0.0, 'vader_score': 0.0, 'sentiment_category': 'Neutral'}",0.0,0.0,Neutral
1hbou9v,Tesla lobbied UK to strengthen rules on carbon emissions from cars and lorries | Tesla,,2024-12-11 08:13:24,36,6,https://www.theguardian.com/technology/2024/dec/10/tesla-uk-to-carbon-emissions-cars-lorries-elon-musk-semi-truck,,"{'textblob_score': 0.0, 'vader_score': 0.0, 'sentiment_category': 'Neutral'}",0.0,0.0,Neutral
1hbopob,"Google asks FTC to break up Microsoft's cloud deal with OpenAI, the Information says",,2024-12-11 08:03:46,32,3,https://www.reuters.com/technology/google-asks-ftc-break-up-microsofts-cloud-deal-with-openai-information-says-2024-12-11/,,"{'textblob_score': 0.0, 'vader_score': 0.0, 'sentiment_category': 'Neutral'}",0.0,0.0,Neutral
1hb1x9o,Former Intel CEO Pat Gelsinger calls for prayer and fasting for employees,,2024-12-10 13:38:05,980,283,https://www.foxbusiness.com/technology/ex-intel-ceo-pat-gelsinger-calls-prayer-fasting-employees,,"{'textblob_score': 0.0, 'vader_score': 0.0, 'sentiment_category': 'Neutral'}",0.0,0.0,Neutral
1hb2ghp,"Chatbots urged teen to self-harm, suggested murdering parents, lawsuit says",,2024-12-10 14:03:54,784,59,https://arstechnica.com/tech-policy/2024/12/chatbots-urged-teen-to-self-harm-suggested-murdering-parents-lawsuit-says/,,"{'textblob_score': 0.0, 'vader_score': 0.0, 'sentiment_category': 'Neutral'}",0.0,0.0,Neutral
1hbcs2q,The Future of Anxiety Relief: Psychedelics Minus the Hallucinogenic Effects,,2024-12-10 21:26:28,184,83,https://scitechdaily.com/the-future-of-anxiety-relief-psychedelics-minus-the-hallucinogenic-effects/,,"{'textblob_score': 0.0, 'vader_score': 0.0, 'sentiment_category': 'Neutral'}",0.0,0.0,Neutral
1hbteu1,WP Engine wins preliminary injunction in WordPress legal battle | The judgement temporarily forces Automattic to restore WPEngine's access to Wordpress.org.,,2024-12-11 13:26:17,9,0,https://www.engadget.com/general/wp-engine-wins-preliminary-injunction-in-wordpress-legal-battle-131527285.html,,"{'textblob_score': 0.0, 'vader_score': 0.0, 'sentiment_category': 'Neutral'}",0.0,0.0,Neutral
1hbfzz9,Salt Typhoon recorded 'very senior' US officials' calls,,2024-12-10 23:50:15,109,7,https://www.theregister.com/2024/12/09/white_house_salt_typhoon/,,"{'textblob_score': 0.0, 'vader_score': 0.0, 'sentiment_category': 'Neutral'}",0.0,0.0,Neutral
1hbdhhm,"Over $6 billion in CHIPS Act funding finalized for Micron plants in the US | The US Commerce Department says Micron’s Idaho and New York plants will create around 20,000 jobs.",,2024-12-10 21:56:58,148,13,https://www.theverge.com/2024/12/10/24317897/micron-chips-act-6-1-billion-subsidy-grant-new-plants-idaho-new-york-virginia,,"{'textblob_score': 0.0, 'vader_score': 0.0, 'sentiment_category': 'Neutral'}",0.0,0.0,Neutral
1hb7rod,"Just to cap off Intel's annus horribilis, Time picks AMD's Dr Lisa Su as its CEO of the year | Definitely a better choice than last year's pick, that's for sure.",,2024-12-10 17:56:51,258,26,https://www.pcgamer.com/hardware/just-to-cap-off-intels-annus-horribilis-time-picks-amds-dr-lisa-su-as-its-ceo-of-the-year/,,"{'textblob_score': 0.0, 'vader_score': 0.0, 'sentiment_category': 'Neutral'}",0.0,0.0,Neutral
1hcingm,Google claims its new Willow quantum chip can swiftly solve a problem that would take a standard supercomputer 10 septillion years.,,2024-12-12 10:59:41,0,36,https://www.tomshardware.com/tech-industry/quantum-computing/google-claims-its-new-willow-quantum-chip-can-swiftly-solve-a-problem-that-would-take-a-standard-supercomputer-10-septillion-years,,"{'textblob_score': 0.0, 'vader_score': 0.0, 'sentiment_category': 'Neutral'}",0.0,0.0,Neutral
1hcgjgh,"Apple reveals new AI chip building partner, and it isn't Amazon",,2024-12-12 08:19:01,0,2,https://www.thestreet.com/technology/apple-reveals-new-ai-chip-building-partner-and-it-isnt-amazon-,,"{'textblob_score': 0.0, 'vader_score': 0.0, 'sentiment_category': 'Neutral'}",0.0,0.0,Neutral
1hc17md,How the AI Boom Threatens to Short-Circuit Climate Action,,2024-12-11 19:06:03,1,2,https://www.audubon.org/magazine/how-ai-boom-threatens-short-circuit-climate-action,,"{'textblob_score': 0.0, 'vader_score': 0.0, 'sentiment_category': 'Neutral'}",0.0,0.0,Neutral
1haij4m,A Software Engineer is Mapping License Plate Readers Nationwide: ‘I don’t like being tracked’,,2024-12-09 19:48:47,18222,732,https://www.al.com/news/2024/11/huntsville-born-software-engineer-mapping-license-plate-readers-nationwide-i-dont-like-being-tracked.html,,"{'textblob_score': 0.0, 'vader_score': 0.0, 'sentiment_category': 'Neutral'}",0.0,0.0,Neutral
1hbgfpy,Location data firm helps police find out when suspects visited their doctor,,2024-12-11 00:09:53,60,4,https://arstechnica.com/tech-policy/2024/12/location-data-firm-helps-police-find-out-when-suspects-visited-their-doctor/,,"{'textblob_score': 0.0, 'vader_score': 0.0, 'sentiment_category': 'Neutral'}",0.0,0.0,Neutral
1hbg22g,"WordPress must stop blocking WP Engine, judge rules",,2024-12-10 23:52:58,63,17,https://www.theverge.com/2024/12/10/24318350/automattic-restore-wp-engine-access-wordpress?utm_content=bufferd1de2&utm_medium=social&utm_source=bufferapp.com&utm_campaign=buffer,,"{'textblob_score': 0.0, 'vader_score': 0.0, 'sentiment_category': 'Neutral'}",0.0,0.0,Neutral
1hb4tzd,"Microsoft 365 outage takes down Office web apps, admin center",,2024-12-10 15:51:59,262,21,https://www.bleepingcomputer.com/news/microsoft/microsoft-365-outage-takes-down-office-web-apps-admin-center/,,"{'textblob_score': 0.0, 'vader_score': 0.0, 'sentiment_category': 'Neutral'}",0.0,0.0,Neutral
1haqje8,Tesla sued by deceased driver’s family over 'fraudulent misrepresentation' of Autopilot safety,,2024-12-10 01:45:32,3346,124,https://www.cnbc.com/2024/12/09/tesla-accused-of-fraudulent-misrepresentation-of-autopilot-in-crash-.html,,"{'textblob_score': 0.0, 'vader_score': 0.0, 'sentiment_category': 'Neutral'}",0.0,0.0,Neutral
1hbgh5l,G.M. Will Stop Developing Self-Driving Taxis,,2024-12-11 00:11:43,41,9,https://www.nytimes.com/2024/12/10/business/gm-cruise-robotaxi.html,,"{'textblob_score': 0.0, 'vader_score': 0.0, 'sentiment_category': 'Neutral'}",0.0,0.0,Neutral
1hb4rdo,Game publishers are refusing to commit to release dates for fear of clashing with GTA 6 | Probably a good idea,,2024-12-10 15:48:59,198,32,https://www.techspot.com/news/105898-game-publishers-refusing-commit-release-dates-fear-clashing.html,,"{'textblob_score': 0.0, 'vader_score': 0.0, 'sentiment_category': 'Neutral'}",0.0,0.0,Neutral
1hanrs9,3D-printed ‘ghost gun’ discovered on suspect in connection to Brian Thompson assassination,,2024-12-09 23:32:32,3454,657,https://www.themirror.com/news/us-news/luigi-mangione-ghost-gun-suspect-849726,,"{'textblob_score': 0.0, 'vader_score': 0.0, 'sentiment_category': 'Neutral'}",0.0,0.0,Neutral
1hbtkee,"In a not-so-subtle signal to regulators, Blue Origin says New Glenn is ready",,2024-12-11 13:34:15,4,0,https://arstechnica.com/space/2024/12/intrigue-swirls-as-blue-origin-races-toward-year-end-deadline-for-new-glenn/,,"{'textblob_score': 0.0, 'vader_score': 0.0, 'sentiment_category': 'Neutral'}",0.0,0.0,Neutral
1hb0o62,Microsoft U-turns on Windows 11 TPM requirement days after doubling down,,2024-12-10 12:30:00,262,81,https://www.techpowerup.com/329691/microsoft-loosens-windows-11-install-requirements-tpm-2-0-not-needed-anymore,,"{'textblob_score': 0.0, 'vader_score': 0.0, 'sentiment_category': 'Neutral'}",0.0,0.0,Neutral
1hb1g6d,"Mozilla Firefox removes ""Do Not Track"" Feature support: Here's what it means for your Privacy",,2024-12-10 13:13:18,204,42,https://windowsreport.com/mozilla-firefox-removes-do-not-track-feature-support-heres-what-it-means-for-your-privacy/,,"{'textblob_score': 0.0, 'vader_score': 0.0, 'sentiment_category': 'Neutral'}",0.0,0.0,Neutral
1hbzaca,Google releases the first of its Gemini 2.0 AI models,,2024-12-11 17:47:17,0,5,https://www.cnbc.com/2024/12/11/google-releases-the-first-of-its-gemini-2point0-ai-models.html,,"{'textblob_score': 0.0, 'vader_score': 0.0, 'sentiment_category': 'Neutral'}",0.0,0.0,Neutral
1hc8xrp,OnlyFans Models Are Using AI Impersonators to Keep Up With Their DMs,,2024-12-12 00:47:09,0,20,https://www.wired.com/story/onlyfans-models-are-using-ai-impersonators-to-keep-up-with-their-dms/,,"{'textblob_score': 0.0, 'vader_score': 0.0, 'sentiment_category': 'Neutral'}",0.0,0.0,Neutral
1hb1kzo,A phone company developed an AI 'granny' to beat scammers at their own game,,2024-12-10 13:20:24,165,16,https://www.npr.org/2024/12/10/nx-s1-5220362/daisy-ai-granny-o2-fraud-spam-prevention,,"{'textblob_score': 0.0, 'vader_score': 0.0, 'sentiment_category': 'Neutral'}",0.0,0.0,Neutral
1harrp0,"Cable ISPs compare data caps to food menus: Don’t make us offer unlimited soup | Data plans compared to a ""tasting menu, a buffet, or unlimited soup and salad.""",,2024-12-10 02:48:52,1129,140,https://arstechnica.com/tech-policy/2024/12/cable-isps-compare-data-caps-to-food-menus-dont-make-us-offer-unlimited-soup/,,"{'textblob_score': 0.0, 'vader_score': 0.0, 'sentiment_category': 'Neutral'}",0.0,0.0,Neutral
1hbhpur,"Video is AI’s new frontier – and it is so persuasive, we should all be worried | I tried Sora, OpenAI’s new tool, and it just left me sad. Are we ready for a world in which we can never tell what is real?",,2024-12-11 01:12:06,17,40,https://www.theguardian.com/commentisfree/2024/dec/10/ai-openai-sora-video-new-frontier,,"{'textblob_score': 0.0, 'vader_score': 0.0, 'sentiment_category': 'Neutral'}",0.0,0.0,Neutral
1hbqqpl,VR is giving new dimensions to understand the technological concepts like jet engines and transformers. ,,2024-12-11 10:41:06,1,0,https://www.meta.com/experiences/ixrlabs-engineering-demo/5978954115548755/?q=js,,"{'textblob_score': 0.0, 'vader_score': 0.0, 'sentiment_category': 'Neutral'}",0.0,0.0,Neutral
1hbnwcf,A Bionic Leg Controlled by the Brain ,,2024-12-11 07:02:48,4,3,https://www.newyorker.com/magazine/2024/12/16/a-bionic-leg-controlled-by-the-brain,,"{'textblob_score': 0.0, 'vader_score': 0.0, 'sentiment_category': 'Neutral'}",0.0,0.0,Neutral
1hbaywc,Astronomers discover one of the fastest-spinning stars in the universe,,2024-12-10 20:10:10,41,24,https://phys.org/news/2024-10-astronomers-fastest-stars-universe.html,,"{'textblob_score': 0.0, 'vader_score': 0.0, 'sentiment_category': 'Neutral'}",0.0,0.0,Neutral
1hbwdy8,"QuantumScape Releases Next-Generation Solid-State Battery Separator Equipment, Cobra",,2024-12-11 15:46:18,0,3,https://finance.yahoo.com/news/quantumscape-releases-next-generation-solid-114500443.html,,"{'textblob_score': 0.0, 'vader_score': 0.0, 'sentiment_category': 'Neutral'}",0.0,0.0,Neutral
1ha7c40,Diamonds can now be created from scratch in the lab in 15 minutes,,2024-12-09 11:06:17,30438,1351,https://www.earth.com/news/real-diamonds-can-now-be-created-from-scratch-in-the-lab-in-just-15-minutes/,,"{'textblob_score': 0.0, 'vader_score': 0.0, 'sentiment_category': 'Neutral'}",0.0,0.0,Neutral
1hbdvxr,Telegram’s cyber attack against Ukraine has been hidden in plain sight,,2024-12-10 22:14:20,23,30,https://thesource.com/2024/12/09/telegrams-cyber-attack-against-ukraine-has-been-hidden-in-plain-sight/,,"{'textblob_score': 0.0, 'vader_score': 0.0, 'sentiment_category': 'Neutral'}",0.0,0.0,Neutral
1hc6zat,TCL TVs will use films made with generative AI to push targeted ads,,2024-12-11 23:12:21,0,20,https://arstechnica.com/gadgets/2024/12/tcl-tvs-will-use-films-made-with-generative-ai-to-push-targeted-ads/,,"{'textblob_score': 0.0, 'vader_score': 0.0, 'sentiment_category': 'Neutral'}",0.0,0.0,Neutral
1ha9x5h,Biden Launched A US Chipmaking Boom. The Jobs Boost Will Come Under Trump.,,2024-12-09 13:39:39,8865,401,https://www.businessinsider.com/semiconductor-manufacturing-jobs-trump-presidency-chips-act-funding-construction-2024-12,,"{'textblob_score': 0.0, 'vader_score': 0.0, 'sentiment_category': 'Neutral'}",0.0,0.0,Neutral
1hbhotq,Paul McCartney warns AI ‘could take over’ as UK debates copyright laws,,2024-12-11 01:10:42,13,8,https://www.theguardian.com/technology/2024/dec/10/paul-mccartney-ai-warning-uk-debates-copyright-laws,,"{'textblob_score': 0.0, 'vader_score': 0.0, 'sentiment_category': 'Neutral'}",0.0,0.0,Neutral
1hb9uyh,Apple’s Next Ultra Smartwatch Will Be Able to Send Texts Via Satellite,,2024-12-10 19:23:23,28,47,https://www.bloomberg.com/news/articles/2024-12-10/apple-plans-apple-watch-ultra-3-next-year-with-satellite-texting-and-5g,,"{'textblob_score': 0.0, 'vader_score': 0.0, 'sentiment_category': 'Neutral'}",0.0,0.0,Neutral
1halhnw,FTC distributes $72M to Fortnite customers tricked into making unwanted purchases ,,2024-12-09 21:51:52,1304,54,https://techcrunch.com/2024/12/09/ftc-distributes-72m-to-fortnite-customers-tricked-into-making-unwanted-purchases/?utm_source=dlvr.it&utm_medium=bluesky,,"{'textblob_score': 0.0, 'vader_score': 0.0, 'sentiment_category': 'Neutral'}",0.0,0.0,Neutral
1hbkdyn,To Fab Or Not To Fab Is The $7B Question For Intel,,2024-12-11 03:29:28,4,1,https://www.theregister.com/2024/12/10/gelsinger_departure_intel_future/,,"{'textblob_score': 0.0, 'vader_score': 0.0, 'sentiment_category': 'Neutral'}",0.0,0.0,Neutral
1hbj0cu,"It's not yet official, but this is the world's smallest arcade machine. Guess what game it plays?",,2024-12-11 02:17:36,7,50,https://www.cbc.ca/news/canada/london/it-s-not-yet-official-but-this-is-the-world-s-smallest-arcade-machine-guess-what-game-it-plays-1.7406570,,"{'textblob_score': 0.0, 'vader_score': 0.0, 'sentiment_category': 'Neutral'}",0.0,0.0,Neutral
1ha8bjj,How Peter Thiel’s network of right-wing techies is infiltrating Donald Trump’s White House,,2024-12-09 12:11:13,6591,347,https://www.yahoo.com/news/peter-thiel-network-wing-techies-235105942.html,,"{'textblob_score': 0.0, 'vader_score': 0.0, 'sentiment_category': 'Neutral'}",0.0,0.0,Neutral
1hc0wnb,Microsoft starts testing iPhone file sharing for Windows PCs,,2024-12-11 18:53:46,0,1,https://www.theverge.com/2024/12/11/24318886/microsoft-phone-link-file-sharing-ios-windows-pcs,,"{'textblob_score': 0.0, 'vader_score': 0.0, 'sentiment_category': 'Neutral'}",0.0,0.0,Neutral
1hab9lu,Apple’s iPhone Hit By FBI Warning And Lawsuit Before iOS 18.2 Release,,2024-12-09 14:44:40,2848,235,https://www.forbes.com/sites/zakdoffman/2024/12/08/apples-iphone-security-suddenly-under-attack-all-users-now-at-risk/,,"{'textblob_score': 0.0, 'vader_score': 0.0, 'sentiment_category': 'Neutral'}",0.0,0.0,Neutral
1hbvw9o,iPhone update brings controversial AI features that let you make pictures of friends,,2024-12-11 15:24:30,0,0,https://www.independent.co.uk/tech/apple-intelligence-generative-b2662573.html,,"{'textblob_score': 0.0, 'vader_score': 0.0, 'sentiment_category': 'Neutral'}",0.0,0.0,Neutral
1hahjg0,TikTok files emergency injunction in latest bid to stall US ban,,2024-12-09 19:07:25,1139,303,https://www.semafor.com/article/12/09/2024/tiktok-files-emergency-injunction-to-pause-us-ban,,"{'textblob_score': 0.0, 'vader_score': 0.0, 'sentiment_category': 'Neutral'}",0.0,0.0,Neutral
1hb0bt9,Dodge maker Stellantis and China's CATL team up to build $4.3 billion EV battery plant in Spain,,2024-12-10 12:09:08,48,1,https://www.cnbc.com/2024/12/10/stellantis-and-catl-to-build-4point3-billion-ev-battery-plant-in-spain.html,,"{'textblob_score': 0.0, 'vader_score': 0.0, 'sentiment_category': 'Neutral'}",0.0,0.0,Neutral
1hb1wdb,A mischievous Yakuza / Like a Dragon fan has tricked Google Maps into including the video game series' iconic Millennium Tower Rooftop as a tourist attraction in its real world Tokyo map,,2024-12-10 13:36:46,36,3,https://www.ign.com/articles/yakuza-like-a-dragon-fan-tricks-google-maps-into-adding-the-millennium-tower-rooftop-into-its-real-tokyo-map,,"{'textblob_score': 0.0, 'vader_score': 0.0, 'sentiment_category': 'Neutral'}",0.0,0.0,Neutral
1hb2bak,FTC refunding $72 million to Fortnite players over ‘unwanted’ purchases | Players are getting money back for Fortnite skins that the FTC claims players were pressured into buying,,2024-12-10 13:57:23,33,3,https://www.videogameschronicle.com/news/ftc-refunding-72-million-to-fortnite-players-over-unwanted-purchases/,,"{'textblob_score': 0.0, 'vader_score': 0.0, 'sentiment_category': 'Neutral'}",0.0,0.0,Neutral
1haj5hc,"Microsoft now allowing Windows 11 on older, incompatible PCs",,2024-12-09 20:14:07,853,238,https://www.pcworld.com/article/2550265/microsoft-now-allowing-windows-11-on-older-incompatible-pcs.html,,"{'textblob_score': 0.0, 'vader_score': 0.0, 'sentiment_category': 'Neutral'}",0.0,0.0,Neutral
1hb0021,US finalizes more than $6.1 billion chips subsidy for Micron Technology,,2024-12-10 11:48:51,50,8,https://finance.yahoo.com/news/us-finalizes-more-6-1-111553170.html,,"{'textblob_score': 0.0, 'vader_score': 0.0, 'sentiment_category': 'Neutral'}",0.0,0.0,Neutral
1hani69,AI slop is already invading Oregon’s local journalism,,2024-12-09 23:20:07,405,3,https://www.opb.org/article/2024/12/09/artificial-intelligence-local-news-oregon-ashland/,,"{'textblob_score': 0.0, 'vader_score': 0.0, 'sentiment_category': 'Neutral'}",0.0,0.0,Neutral
1hb760h,Nvidia Forges Deals In American Southwest And Southeastern Asia,,2024-12-10 17:31:15,13,0,https://www.gzeromedia.com/gzero-ai/nvidia-forges-deals-in-american-southwest-and-southeastern-asia,,"{'textblob_score': 0.0, 'vader_score': 0.0, 'sentiment_category': 'Neutral'}",0.0,0.0,Neutral
1haufe4,Why thermal batteries could replace lithium-ion batteries for energy storage,,2024-12-10 05:13:49,125,34,https://www.cnbc.com/2024/12/06/why-thermal-batteries-could-replace-lithium-ion-batteries-.html,,"{'textblob_score': 0.0, 'vader_score': 0.0, 'sentiment_category': 'Neutral'}",0.0,0.0,Neutral
1hbt1pg,Apple launches its ChatGPT integration with Siri,,2024-12-11 13:06:51,0,5,https://www.cnbc.com/2024/12/11/apple-launches-its-chatgpt-integration-with-siri.html,,"{'textblob_score': 0.0, 'vader_score': 0.0, 'sentiment_category': 'Neutral'}",0.0,0.0,Neutral
1hb5kqb,California Police Use AI to Transcribe Body Cam Videos,,2024-12-10 16:24:06,15,6,https://www.govtech.com/artificial-intelligence/california-police-use-ai-to-transcribe-body-cam-videos,,"{'textblob_score': 0.0, 'vader_score': 0.0, 'sentiment_category': 'Neutral'}",0.0,0.0,Neutral
1hb1iyq,EU cybersecurity rules for smart devices enter into force ,,2024-12-10 13:17:23,24,4,https://techcrunch.com/2024/12/10/eu-cybersecurity-rules-for-smart-devices-enter-into-force/,,"{'textblob_score': 0.0, 'vader_score': 0.0, 'sentiment_category': 'Neutral'}",0.0,0.0,Neutral
1haded3,"Mercedes is working on ""solar paint"" that could drastically reduce the need for charging",,2024-12-09 16:18:29,1247,88,https://www.techspot.com/news/105884-mercedes-working-solar-paint-could-eliminate-need-charging.html,,"{'textblob_score': 0.0, 'vader_score': 0.0, 'sentiment_category': 'Neutral'}",0.0,0.0,Neutral
1haj08i,Google’s quantum chip solves ‘impossible’ problems in five minutes,,2024-12-09 20:08:08,598,260,https://www.yahoo.com/tech/google-quantum-chip-solves-impossible-185004890.html,,"{'textblob_score': 0.0, 'vader_score': 0.0, 'sentiment_category': 'Neutral'}",0.0,0.0,Neutral
1hbwdv4,The AI revolution is running out of data. What can researchers do?,,2024-12-11 15:46:11,0,12,https://www.nature.com/articles/d41586-024-03990-2,,"{'textblob_score': 0.0, 'vader_score': 0.0, 'sentiment_category': 'Neutral'}",0.0,0.0,Neutral
1hae4lx,"Sick Americans say they’re turning to TikTok’s creator rewards program to crowdfund medical bills - As public outrage grows over the U.S. healthcare system, some social media creators say they’re using TikTok payouts of $1 per 1,000 views to raise money for treatment costs.",,2024-12-09 16:49:23,892,48,https://www.fastcompany.com/91242285/sick-americans-using-tiktok-creator-rewards-program-to-fund-health-care-pay-medical-bills,,"{'textblob_score': 0.0, 'vader_score': 0.0, 'sentiment_category': 'Neutral'}",0.0,0.0,Neutral
1hbx5lh,Microsoft gives Alt+Space shortcut over to Copilot,,2024-12-11 16:19:01,0,21,https://www.theregister.com/2024/12/11/microsoft_copilot_keyboard_shortcut/?utm_source=dlvr.it&utm_medium=bluesky,,"{'textblob_score': 0.0, 'vader_score': 0.0, 'sentiment_category': 'Neutral'}",0.0,0.0,Neutral
1hbxx5k,Google unveils Project Mariner: AI agents to use the web for you | TechCrunch,,2024-12-11 16:51:01,0,12,https://techcrunch.com/2024/12/11/google-unveils-project-mariner-ai-agents-to-use-the-web-for-you/,,"{'textblob_score': 0.0, 'vader_score': 0.0, 'sentiment_category': 'Neutral'}",0.0,0.0,Neutral
1haac7r,Russia’s Military Found A Surprisingly Simple Way To Buy US Chips,,2024-12-09 14:00:35,1223,103,https://www.bloomberg.com/news/features/2024-12-09/russia-s-military-buying-us-chips-from-texas-instruments-despite-sanctions,,"{'textblob_score': 0.0, 'vader_score': 0.0, 'sentiment_category': 'Neutral'}",0.0,0.0,Neutral
1haz6ya,Interview: Why diamonds may be a computer's best friend,,2024-12-10 10:54:27,23,16,https://newatlas.com/computers/interview-why-diamonds-computers-best-friend/,,"{'textblob_score': 0.0, 'vader_score': 0.0, 'sentiment_category': 'Neutral'}",0.0,0.0,Neutral
1hb1ibi,Microsoft Unveils Zero-Water Data Centers to Reduce AI Climate Impact,,2024-12-10 13:16:24,12,3,https://www.bloomberg.com/news/articles/2024-12-09/microsoft-unveils-zero-water-data-centers-to-reduce-ai-climate-impact,,"{'textblob_score': 0.0, 'vader_score': 0.0, 'sentiment_category': 'Neutral'}",0.0,0.0,Neutral
1hbvz67,Russia teams up with BRICS to create AI alliance,,2024-12-11 15:28:07,0,2,https://www.reuters.com/technology/artificial-intelligence/russia-teams-up-with-brics-create-ai-alliance-putin-says-2024-12-11/,,"{'textblob_score': 0.0, 'vader_score': 0.0, 'sentiment_category': 'Neutral'}",0.0,0.0,Neutral
1hbvh5f,"Intel should have focused on AI rather than chipmaking, TSMC founder says ",,2024-12-11 15:05:21,0,8,https://www.reuters.com/technology/intel-should-have-focused-ai-rather-than-chipmaking-tsmc-founder-says-2024-12-09/?s=31,,"{'textblob_score': 0.0, 'vader_score': 0.0, 'sentiment_category': 'Neutral'}",0.0,0.0,Neutral
1hbwo4i,TikTok Offers Cash to Users to Recruit Friends Ahead of US Ban,,2024-12-11 15:58:35,0,16,https://www.thewrap.com/tiktok-offers-cash-users-recruit-friends-us-ban/,,"{'textblob_score': 0.0, 'vader_score': 0.0, 'sentiment_category': 'Neutral'}",0.0,0.0,Neutral
1hanill,Ransomware attack hits leading heart surgery device maker,,2024-12-09 23:20:41,140,3,https://www.bleepingcomputer.com/news/security/ransomware-attack-hits-leading-heart-surgery-device-maker/,,"{'textblob_score': 0.0, 'vader_score': 0.0, 'sentiment_category': 'Neutral'}",0.0,0.0,Neutral
